{"protocol_version":"0.1.0-alpha.3","request_id":"mreq_00000000000000000000000000000002","trace_id":"trace_00000000000000000000000000000002","ok":true,"authorization":{"decision":"allow","reason_code":"ALLOW"},"audit_id":2,"data":{"secret_ref":"secretref://example/item","status":"active"},"error":null}
