{"protocol_version":"0.1.0-alpha.3","request_id":"mreq_00000000000000000000000000000006","trace_id":"trace_00000000000000000000000000000006","ok":false,"authorization":{"decision":"deny","reason_code":"IDEMPOTENCY_FINGERPRINT_CONFLICT"},"audit_id":6,"data":null,"error":{"code":"IDEMPOTENCY_FINGERPRINT_CONFLICT","message":"The idempotency key was used with different arguments.","retryable":false}}
